byte[1] Left Stick X
byte[2] Left Stick Y
byte[3] Right Stick X
byte[4] Right Stick Y

01-80-7F-80-7F-08-00-74 IDLE

01-80-7F-80-7F-00-00-74 D-PAD UP PRESSED
01-80-7F-80-7F-08-00-74 D-PAD UP RELEASE

01-80-7F-80-7F-04-00-74 D-PAD DOWN PRESSED
01-80-7F-80-7F-08-00-74 D-PAD DOWN RELEASE

01-80-7F-80-7F-02-00-74 D-PAD RIGHT PRESSED
01-80-7F-80-7F-08-00-74 D-PAD RIGHT RELEASE

01-80-7F-80-7F-06-00-74 D-PAD LEFT PRESSED
01-80-7F-80-7F-08-00-74 D-PAD LEFT RELEASE

01-80-7F-80-7F-01-00-74 D-PAD UP-RIGHT
01-80-7F-80-7F-07-00-74 D-PAD UP-LEFT

01-80-7F-80-7F-03-00-74 D-PAD DOWN-RIGHT
01-80-7F-80-7F-05-00-74 D-PAD DOWN-LEFT

01-80-7F-80-7F-08-01-74 L1 PRESSED
01-80-7F-80-7F-08-04-74 L2 PRESSED
01-80-7F-80-7F-08-40-74 L3 PRESSED
01-80-7F-80-7F-08-05-74 L1+L2 PRESSED

01-80-7F-80-7F-08-02-74 R1 PRESSED
01-80-7F-80-7F-08-08-74 R2 PRESSED
01-80-7F-80-7F-08-80-74 R3 PRESSED
01-80-7F-80-7F-08-0A-74 R1+R2 PRESSED

01-80-7F-80-7F-08-10-74 SELECT
01-80-7F-80-7F-08-20-74 START
01-80-7F-80-7F-08-30-74 SELECT+START

01-80-7F-80-7F-18-00-74 SQUARE / XBOX-X
01-80-7F-80-7F-88-00-74 TRIANGLE / XBOX-Y
01-80-7F-80-7F-48-00-74 CIRCLE / XBOX-B
01-80-7F-80-7F-28-00-74 CROSS / XBOX-A


01-80-7F-80-7F-08-00-54 VIBRATION SHORT ??
01-80-7F-80-7F-08-00-74 VIBRATION LONG ??




    =========================== USB Port6 ===========================

Connection Status        : 0x01 (Device is connected)
Port Chain               : 1-6
Properties               : 0x00
 IsUserConnectable       : no
 PortIsDebugCapable      : no
 PortHasMultiCompanions  : no
 PortConnectorIsTypeC    : no
ConnectionIndex          : 0x06 (Port 6)

      ========================== Summary =========================
Vendor ID                : 0x046D (Logitech Inc.)
Product ID               : 0xC219
Manufacturer String      : "Logitech"
Product String           : "Logitech Cordless RumblePad 2"
Serial                   : ---
USB Version              : 2.0 (but 12 Mbit/s FullSpeed only)
Port maximum Speed       : High-Speed
Device maximum Speed     : Full-Speed
Device Connection Speed  : Full-Speed
Self powered             : no
Demanded Current         : 98 mA
Used Endpoints           : 3

      ======================== USB Device ========================

        +++++++++++++++++ Device Information ++++++++++++++++++
Device Description       : USB Giriş Aygıtı
BusReported Device Desc  : Logitech Cordless RumblePad 2
Device Path              : \\?\USB#VID_046D&PID_C219#5&288afdf&0&6#{a5dcbf10-6530-11d2-901f-00c04fb951ed} (GUID_DEVINTERFACE_USB_DEVICE)
Kernel Name              : \Device\USBPDO-4
Device ID                : USB\VID_046D&PID_C219\5&288AFDF&0&6
Hardware IDs             : USB\VID_046D&PID_C219&REV_0305 USB\VID_046D&PID_C219
Driver KeyName           : {745a17a0-74d3-11d0-b6fe-00a0c90f57da}\0033 (GUID_DEVCLASS_HIDCLASS)
Driver                   : \SystemRoot\System32\drivers\hidusb.sys (Version: 10.0.19041.3636  Date: 2023-11-15  Company: Microsoft Corporation)
Driver Inf               : C:\Windows\inf\input.inf
Legacy BusType           : PNPBus
Class                    : HIDClass
Class GUID               : {745a17a0-74d3-11d0-b6fe-00a0c90f57da} (GUID_DEVCLASS_HIDCLASS)
Service                  : HidUsb
Enumerator               : USB
Location Info            : Port_#0006.Hub_#0002
Address                  : 6
Location IDs             : PCIROOT(0)#PCI(1400)#USBROOT(0)#USB(6), ACPI(_SB_)#ACPI(PC00)#ACPI(XHCI)#ACPI(RHUB)#ACPI(HS06)
Container ID             : {2a373d01-e59d-11f0-9716-d8bbc16b5e8f}
Manufacturer Info        : (Standart sistem aygıtları)
Capabilities             : 0x84 (Removable, SurpriseRemovalOK)
Status                   : 0x0180600A (DN_DRIVER_LOADED, DN_STARTED, DN_DISABLEABLE, DN_REMOVABLE, DN_NT_ENUMERATOR, DN_NT_DRIVER)
First Install Date       : 2025-12-31 00:08:34
Last Arrival Date        : 2025-12-31 18:14:00
Bus Relations            : HID\VID_046D&PID_C219\6&22edfad2&0&0000
SelectiveSuspendEnabled  : 0
EnhancedPowerMgmtEnabled : 1
Power State              : D0 (supported: D0, D3, wake from D0)

        +++++++++++++++++ Registry USB Flags +++++++++++++++++
HKEY_LOCAL_MACHINE\SYSTEM\CurrentControlSet\Control\usbflags\046DC2190305
 osvc                    : REG_BINARY 00 00

        ---------------- Connection Information ---------------
Connection Index         : 0x06 (Port 6)
Connection Status        : 0x01 (DeviceConnected)
Current Config Value     : 0x01 (Configuration 1)
Device Address           : 0x0C (12)
Is Hub                   : 0x00 (no)
Device Bus Speed         : 0x01 (Full-Speed)
Number of open Pipes     : 0x02 (2 pipes to data endpoints)
Pipe[0]                  : EndpointID=1  Direction=IN   ScheduleOffset=0  Type=Interrupt  wMaxPacketSize=0x20    bInterval=4   -> 420 Bits/ms = 52500 Bytes/s
Pipe[1]                  : EndpointID=1  Direction=OUT  ScheduleOffset=0  Type=Interrupt  wMaxPacketSize=0x20    bInterval=8   -> 420 Bits/ms = 52500 Bytes/s

        --------------- Connection Information V2 -------------
Connection Index         : 0x06 (6)
Length                   : 0x10 (16 bytes)
SupportedUsbProtocols    : 0x03
 Usb110                  : 1 (yes, port supports USB 1.1)
 Usb200                  : 1 (yes, port supports USB 2.0)
 Usb300                  : 0 (no, port not supports USB 3.0)
 ReservedMBZ             : 0x00
Flags                    : 0x00
 DevIsOpAtSsOrHigher     : 0 (Device is not operating at SuperSpeed or higher)
 DevIsSsCapOrHigher      : 0 (Device is not SuperSpeed capable or higher)
 DevIsOpAtSsPlusOrHigher : 0 (Device is not operating at SuperSpeedPlus or higher)
 DevIsSsPlusCapOrHigher  : 0 (Device is not SuperSpeedPlus capable or higher)
 ReservedMBZ             : 0x00

    ---------------------- Device Descriptor ----------------------
bLength                  : 0x12 (18 bytes)
bDescriptorType          : 0x01 (Device Descriptor)
bcdUSB                   : 0x200 (USB Version 2.0) -> but device is Full-Speed only
bDeviceClass             : 0x00 (defined by the interface descriptors)
bDeviceSubClass          : 0x00
bDeviceProtocol          : 0x00
bMaxPacketSize0          : 0x08 (8 bytes)
idVendor                 : 0x046D (Logitech Inc.)
idProduct                : 0xC219
bcdDevice                : 0x0305
iManufacturer            : 0x01 (String Descriptor 1)
 Language 0x0409         : "Logitech"
iProduct                 : 0x02 (String Descriptor 2)
 Language 0x0409         : "Logitech Cordless RumblePad 2"
iSerialNumber            : 0x00 (No String Descriptor)
bNumConfigurations       : 0x01 (1 Configuration)

    ------------------ Configuration Descriptor -------------------
bLength                  : 0x09 (9 bytes)
bDescriptorType          : 0x02 (Configuration Descriptor)
wTotalLength             : 0x0029 (41 bytes)
bNumInterfaces           : 0x01 (1 Interface)
bConfigurationValue      : 0x01 (Configuration 1)
iConfiguration           : 0x04 (String Descriptor 4)
 *!*ERROR  String descriptor not found
bmAttributes             : 0x80
 D7: Reserved, set 1     : 0x01
 D6: Self Powered        : 0x00 (no)
 D5: Remote Wakeup       : 0x00 (no)
 D4..0: Reserved, set 0  : 0x00
MaxPower                 : 0x31 (98 mA)

        ---------------- Interface Descriptor -----------------
bLength                  : 0x09 (9 bytes)
bDescriptorType          : 0x04 (Interface Descriptor)
bInterfaceNumber         : 0x00 (Interface 0)
bAlternateSetting        : 0x00
bNumEndpoints            : 0x02 (2 Endpoints)
bInterfaceClass          : 0x03 (HID - Human Interface Device)
bInterfaceSubClass       : 0x00 (None)
bInterfaceProtocol       : 0x00 (None)
iInterface               : 0x00 (No String Descriptor)

        ------------------- HID Descriptor --------------------
bLength                  : 0x09 (9 bytes)
bDescriptorType          : 0x21 (HID Descriptor)
bcdHID                   : 0x0111 (HID Version 1.11)
bCountryCode             : 0x00 (00 = not localized)
bNumDescriptors          : 0x01
Descriptor 1:
bDescriptorType          : 0x22 (Class=Report)
wDescriptorLength        : 0x0077 (119 bytes)
Error reading descriptor : ERROR_GEN_FAILURE (due to a obscure limitation of the Win32 USB API, see F1 Help)

        ----------------- Endpoint Descriptor -----------------
bLength                  : 0x07 (7 bytes)
bDescriptorType          : 0x05 (Endpoint Descriptor)
bEndpointAddress         : 0x81 (Direction=IN EndpointID=1)
bmAttributes             : 0x03 (TransferType=Interrupt)
wMaxPacketSize           : 0x0020 (32 bytes)
bInterval                : 0x04 (4 ms)

        ----------------- Endpoint Descriptor -----------------
bLength                  : 0x07 (7 bytes)
bDescriptorType          : 0x05 (Endpoint Descriptor)
bEndpointAddress         : 0x01 (Direction=OUT EndpointID=1)
bmAttributes             : 0x03 (TransferType=Interrupt)
wMaxPacketSize           : 0x0020 (32 bytes)
bInterval                : 0x08 (8 ms)

    ----------------- Device Qualifier Descriptor -----------------
Error                    : request skipped because low-speed device

      -------------------- String Descriptors -------------------
             ------ String Descriptor 0 ------
bLength                  : 0x04 (4 bytes)
bDescriptorType          : 0x03 (String Descriptor)
Language ID[0]           : 0x0409 (English - United States)
             ------ String Descriptor 1 ------
bLength                  : 0x12 (18 bytes)
bDescriptorType          : 0x03 (String Descriptor)
Language 0x0409          : "Logitech"
             ------ String Descriptor 2 ------
bLength                  : 0x3C (60 bytes)
bDescriptorType          : 0x03 (String Descriptor)
Language 0x0409          : "Logitech Cordless RumblePad 2"
